{
  "schema_version": "agmind.evidence-repair-authorize.v1",
  "repair_id": "11111111-1111-4111-8111-111111111111",
  "segment_id": "22222222-2222-4222-8222-222222222222",
  "verified_bytes": 4096,
  "discarded_bytes": 512,
  "discarded_sha256": "1111111111111111111111111111111111111111111111111111111111111111",
  "last_verified_frame_sha256": "2222222222222222222222222222222222222222222222222222222222222222",
  "current_chain_head_sha256": "3333333333333333333333333333333333333333333333333333333333333333",
  "reason": "torn_open_tail"
}
